{
  "version": "1.0.0",
  "states": [
    {
      "name": "initializing",
      "terminal": false,
      "requiredArtifacts": ["release", "operation", "contextHash"],
      "allowedTransitions": ["validating", "failed", "cancelled"],
      "allowedPortOperations": ["clock.now"],
      "allowsContinue": false,
      "memoryRequired": [],
      "memoryAllowed": []
    },
    {
      "name": "validating",
      "terminal": false,
      "requiredArtifacts": ["trustedTime", "normalizedOperation"],
      "allowedTransitions": ["authorizing", "completed", "failed", "cancelled"],
      "allowedPortOperations": [],
      "allowsContinue": true,
      "memoryRequired": ["trustedTime"],
      "memoryAllowed": ["trustedTime"]
    },
    {
      "name": "authorizing",
      "terminal": false,
      "requiredArtifacts": ["permissionSnapshot"],
      "allowedTransitions": ["authorizing", "resolving", "approval", "committing", "completed", "rejected", "failed", "cancelled"],
      "allowedPortOperations": ["permissionStore.load"],
      "allowsContinue": false,
      "memoryRequired": ["trustedTime"],
      "memoryAllowed": ["trustedTime", "permissionLoads"]
    },
    {
      "name": "resolving",
      "terminal": false,
      "requiredArtifacts": ["resolvedInputs"],
      "allowedTransitions": ["resolving", "planning", "approval", "completed", "failed", "cancelled"],
      "allowedPortOperations": ["accounts.resolve", "chainData.resolve", "policy.resolve", "reviewedTransaction.review", "entropy.randomBytes"],
      "allowsContinue": false,
      "memoryRequired": ["trustedTime", "permissionLoads"],
      "memoryAllowed": ["trustedTime", "permissionLoads", "accountResolutions", "requestHash", "normalizedTransaction", "chainSnapshot", "executionPolicy", "workflowPolicies", "reviewedTransactionReviews", "messageEnvelope", "typedDataEnvelope", "walletActionPlan"]
    },
    {
      "name": "planning",
      "terminal": false,
      "requiredArtifacts": ["requestHash"],
      "allowedTransitions": ["planning", "approval", "failed", "cancelled"],
      "allowedPortOperations": ["clock.now"],
      "allowsContinue": true,
      "memoryRequired": ["trustedTime", "permissionLoads", "accountResolutions", "requestHash"],
      "memoryAllowed": ["trustedTime", "requestHash", "permissionLoads", "accountResolutions", "normalizedTransaction", "chainSnapshot", "executionPolicy", "workflowPolicies", "reviewedTransactionReviews", "executionPlan", "workflowPlan"]
    },
    {
      "name": "approval",
      "terminal": false,
      "requiredArtifacts": ["approvalBinding", "approvalPreview"],
      "allowedTransitions": ["approval", "signing", "committing", "completed", "rejected", "failed", "cancelled"],
      "allowedPortOperations": ["clock.now", "approval.request"],
      "allowsContinue": false,
      "memoryRequired": ["trustedTime", "permissionLoads", "approvalBinding", "approvalPreview"],
      "memoryAllowed": ["trustedTime", "requestHash", "permissionLoads", "accountResolutions", "normalizedTransaction", "chainSnapshot", "executionPolicy", "workflowPolicies", "reviewedTransactionReviews", "executionPlan", "permissionProposal", "chainSwitchProposal", "messageEnvelope", "typedDataEnvelope", "workflowPlan", "walletActionPlan", "approvalBinding", "approvalPreview"]
    },
    {
      "name": "signing",
      "terminal": false,
      "requiredArtifacts": ["approvalReceipt", "signingTask"],
      "allowedTransitions": ["signing", "finalizing", "completed", "failed", "cancelled"],
      "allowedPortOperations": ["clock.now", "signer.sign", "crypto.execute", "reviewedTransaction.execute"],
      "allowsContinue": false,
      "memoryRequired": ["trustedTime", "approvalBinding", "approvalReceipt", "signingTasks"],
      "memoryAllowed": ["trustedTime", "requestHash", "permissionLoads", "accountResolutions", "normalizedTransaction", "chainSnapshot", "executionPolicy", "workflowPolicies", "reviewedTransactionReviews", "executionPlan", "messageEnvelope", "typedDataEnvelope", "workflowPlan", "walletActionPlan", "approvalBinding", "approvalPreview", "approvalReceipt", "signingTasks", "signatures", "cryptoResults", "reviewedTransactionResults", "workflowProgress"]
    },
    {
      "name": "finalizing",
      "terminal": false,
      "requiredArtifacts": ["signatures"],
      "allowedTransitions": ["signing", "finalizing", "broadcasting", "completed", "failed", "cancelled"],
      "allowedPortOperations": ["clock.now"],
      "allowsContinue": true,
      "memoryRequired": ["trustedTime", "approvalBinding", "approvalReceipt", "signingTasks", "signatures"],
      "memoryAllowed": ["trustedTime", "requestHash", "permissionLoads", "accountResolutions", "normalizedTransaction", "chainSnapshot", "executionPolicy", "workflowPolicies", "reviewedTransactionReviews", "executionPlan", "messageEnvelope", "typedDataEnvelope", "workflowPlan", "approvalBinding", "approvalPreview", "approvalReceipt", "signingTasks", "signatures", "cryptoResults", "reviewedTransactionResults", "finalizedBundle", "workflowProgress"]
    },
    {
      "name": "broadcasting",
      "terminal": false,
      "requiredArtifacts": ["finalizedBundle"],
      "allowedTransitions": ["broadcasting", "reconciliation", "completed", "failed", "cancelled"],
      "allowedPortOperations": ["clock.now", "broadcast.submit", "broadcast.submitBatch"],
      "allowsContinue": false,
      "memoryRequired": ["trustedTime", "approvalBinding", "approvalReceipt", "signatures", "finalizedBundle", "broadcastProgress"],
      "memoryAllowed": ["trustedTime", "requestHash", "permissionLoads", "accountResolutions", "normalizedTransaction", "chainSnapshot", "executionPolicy", "workflowPolicies", "reviewedTransactionReviews", "executionPlan", "workflowPlan", "workflowResult", "approvalBinding", "approvalPreview", "approvalReceipt", "signingTasks", "signatures", "cryptoResults", "reviewedTransactionResults", "finalizedBundle", "workflowProgress", "broadcastProgress"]
    },
    {
      "name": "reconciliation",
      "terminal": false,
      "requiredArtifacts": ["submittedTransactionIds"],
      "allowedTransitions": ["completed", "failed", "cancelled"],
      "allowedPortOperations": ["broadcast.reconcile"],
      "allowsContinue": false,
      "memoryRequired": ["trustedTime", "finalizedBundle", "broadcastProgress"],
      "memoryAllowed": ["trustedTime", "requestHash", "permissionLoads", "accountResolutions", "normalizedTransaction", "chainSnapshot", "executionPolicy", "executionPlan", "approvalBinding", "approvalPreview", "approvalReceipt", "signingTasks", "signatures", "finalizedBundle", "broadcastProgress"]
    },
    {
      "name": "committing",
      "terminal": false,
      "requiredArtifacts": ["commitKind"],
      "allowedTransitions": ["committing", "completed", "failed", "cancelled"],
      "allowedPortOperations": ["clock.now", "permissionStore.commit"],
      "allowsContinue": false,
      "memoryRequired": ["trustedTime"],
      "memoryAllowed": ["trustedTime", "requestHash", "permissionLoads", "accountResolutions", "normalizedTransaction", "chainSnapshot", "executionPolicy", "executionPlan", "permissionProposal", "chainSwitchProposal", "approvalBinding", "approvalPreview", "permissionCommit", "providerSessionMutation", "providerSessionCommitAck"]
    },
    {
      "name": "completed",
      "terminal": true,
      "requiredArtifacts": ["providerCompletion"],
      "allowedTransitions": [],
      "allowedPortOperations": [],
      "allowsContinue": false,
      "memoryRequired": ["providerCompletion"],
      "memoryAllowed": ["trustedTime", "requestHash", "permissionLoads", "accountResolutions", "normalizedTransaction", "chainSnapshot", "executionPolicy", "workflowPolicies", "reviewedTransactionReviews", "executionPlan", "permissionProposal", "chainSwitchProposal", "messageEnvelope", "typedDataEnvelope", "workflowPlan", "walletActionPlan", "approvalBinding", "approvalPreview", "approvalReceipt", "signingTasks", "signatures", "cryptoResults", "reviewedTransactionResults", "finalizedBundle", "workflowProgress", "permissionCommit", "broadcastProgress", "providerSessionMutation", "providerSessionCommitAck", "providerCompletion"]
    },
    {
      "name": "rejected",
      "terminal": true,
      "requiredArtifacts": ["cancellationReason"],
      "allowedTransitions": [],
      "allowedPortOperations": [],
      "allowsContinue": false,
      "memoryRequired": [],
      "memoryAllowed": ["trustedTime", "requestHash", "permissionLoads", "accountResolutions", "normalizedTransaction", "chainSnapshot", "executionPolicy", "workflowPolicies", "reviewedTransactionReviews", "executionPlan", "permissionProposal", "chainSwitchProposal", "messageEnvelope", "typedDataEnvelope", "workflowPlan", "walletActionPlan", "approvalBinding", "approvalPreview", "approvalReceipt", "signingTasks", "signatures", "cryptoResults", "reviewedTransactionResults", "finalizedBundle", "workflowProgress", "permissionCommit", "broadcastProgress", "providerSessionMutation", "providerSessionCommitAck", "providerCompletion"]
    },
    {
      "name": "failed",
      "terminal": true,
      "requiredArtifacts": ["providerError"],
      "allowedTransitions": [],
      "allowedPortOperations": [],
      "allowsContinue": false,
      "memoryRequired": [],
      "memoryAllowed": ["trustedTime", "requestHash", "permissionLoads", "accountResolutions", "normalizedTransaction", "chainSnapshot", "executionPolicy", "workflowPolicies", "reviewedTransactionReviews", "executionPlan", "permissionProposal", "chainSwitchProposal", "messageEnvelope", "typedDataEnvelope", "workflowPlan", "walletActionPlan", "approvalBinding", "approvalPreview", "approvalReceipt", "signingTasks", "signatures", "cryptoResults", "reviewedTransactionResults", "finalizedBundle", "workflowProgress", "permissionCommit", "broadcastProgress", "providerSessionMutation", "providerSessionCommitAck", "providerCompletion"]
    },
    {
      "name": "cancelled",